{
  "schema_version": "1.0.0",
  "tier": 1,
  "timestamp_utc": "2025-08-19T18:09:54.975660+00:00",
  "target_rootfs": "/",
  "kernel": "4.4.0",
  "distro": {
    "id": "debian",
    "name": "Debian GNU/Linux",
    "version_id": "12",
    "pretty_name": "Debian GNU/Linux 12 (bookworm)"
  },
  "users": [
    {
      "name": "root",
      "uid": 0,
      "gid": 0,
      "home": "/root",
      "shell": "/bin/bash"
    },
    {
      "name": "daemon",
      "uid": 1,
      "gid": 1,
      "home": "/usr/sbin",
      "shell": "/usr/sbin/nologin"
    },
    {
      "name": "bin",
      "uid": 2,
      "gid": 2,
      "home": "/bin",
      "shell": "/usr/sbin/nologin"
    },
    {
      "name": "sys",
      "uid": 3,
      "gid": 3,
      "home": "/dev",
      "shell": "/usr/sbin/nologin"
    },
    {
      "name": "sync",
      "uid": 4,
      "gid": 65534,
      "home": "/bin",
      "shell": "/bin/sync"
    },
    {
      "name": "games",
      "uid": 5,
      "gid": 60,
      "home": "/usr/games",
      "shell": "/usr/sbin/nologin"
    },
    {
      "name": "man",
      "uid": 6,
      "gid": 12,
      "home": "/var/cache/man",
      "shell": "/usr/sbin/nologin"
    },
    {
      "name": "lp",
      "uid": 7,
      "gid": 7,
      "home": "/var/spool/lpd",
      "shell": "/usr/sbin/nologin"
    },
    {
      "name": "mail",
      "uid": 8,
      "gid": 8,
      "home": "/var/mail",
      "shell": "/usr/sbin/nologin"
    },
    {
      "name": "news",
      "uid": 9,
      "gid": 9,
      "home": "/var/spool/news",
      "shell": "/usr/sbin/nologin"
    },
    {
      "name": "uucp",
      "uid": 10,
      "gid": 10,
      "home": "/var/spool/uucp",
      "shell": "/usr/sbin/nologin"
    },
    {
      "name": "proxy",
      "uid": 13,
      "gid": 13,
      "home": "/bin",
      "shell": "/usr/sbin/nologin"
    },
    {
      "name": "www-data",
      "uid": 33,
      "gid": 33,
      "home": "/var/www",
      "shell": "/usr/sbin/nologin"
    },
    {
      "name": "backup",
      "uid": 34,
      "gid": 34,
      "home": "/var/backups",
      "shell": "/usr/sbin/nologin"
    },
    {
      "name": "list",
      "uid": 38,
      "gid": 38,
      "home": "/var/list",
      "shell": "/usr/sbin/nologin"
    },
    {
      "name": "irc",
      "uid": 39,
      "gid": 39,
      "home": "/run/ircd",
      "shell": "/usr/sbin/nologin"
    },
    {
      "name": "_apt",
      "uid": 42,
      "gid": 65534,
      "home": "/nonexistent",
      "shell": "/usr/sbin/nologin"
    },
    {
      "name": "nobody",
      "uid": 65534,
      "gid": 65534,
      "home": "/nonexistent",
      "shell": "/usr/sbin/nologin"
    },
    {
      "name": "systemd-network",
      "uid": 998,
      "gid": 998,
      "home": "/",
      "shell": "/usr/sbin/nologin"
    },
    {
      "name": "systemd-timesync",
      "uid": 997,
      "gid": 997,
      "home": "/",
      "shell": "/usr/sbin/nologin"
    },
    {
      "name": "messagebus",
      "uid": 100,
      "gid": 102,
      "home": "/nonexistent",
      "shell": "/usr/sbin/nologin"
    },
    {
      "name": "polkitd",
      "uid": 996,
      "gid": 996,
      "home": "/nonexistent",
      "shell": "/usr/sbin/nologin"
    },
    {
      "name": "sandbox",
      "uid": 1000,
      "gid": 1000,
      "home": "/home/sandbox",
      "shell": "/bin/bash"
    }
  ],
  "groups": [
    {
      "name": "root",
      "gid": 0,
      "members": []
    },
    {
      "name": "daemon",
      "gid": 1,
      "members": []
    },
    {
      "name": "bin",
      "gid": 2,
      "members": []
    },
    {
      "name": "sys",
      "gid": 3,
      "members": []
    },
    {
      "name": "adm",
      "gid": 4,
      "members": []
    },
    {
      "name": "tty",
      "gid": 5,
      "members": []
    },
    {
      "name": "disk",
      "gid": 6,
      "members": []
    },
    {
      "name": "lp",
      "gid": 7,
      "members": []
    },
    {
      "name": "mail",
      "gid": 8,
      "members": []
    },
    {
      "name": "news",
      "gid": 9,
      "members": []
    },
    {
      "name": "uucp",
      "gid": 10,
      "members": []
    },
    {
      "name": "man",
      "gid": 12,
      "members": []
    },
    {
      "name": "proxy",
      "gid": 13,
      "members": []
    },
    {
      "name": "kmem",
      "gid": 15,
      "members": []
    },
    {
      "name": "dialout",
      "gid": 20,
      "members": []
    },
    {
      "name": "fax",
      "gid": 21,
      "members": []
    },
    {
      "name": "voice",
      "gid": 22,
      "members": []
    },
    {
      "name": "cdrom",
      "gid": 24,
      "members": []
    },
    {
      "name": "floppy",
      "gid": 25,
      "members": []
    },
    {
      "name": "tape",
      "gid": 26,
      "members": []
    },
    {
      "name": "sudo",
      "gid": 27,
      "members": []
    },
    {
      "name": "audio",
      "gid": 29,
      "members": []
    },
    {
      "name": "dip",
      "gid": 30,
      "members": []
    },
    {
      "name": "www-data",
      "gid": 33,
      "members": []
    },
    {
      "name": "backup",
      "gid": 34,
      "members": []
    },
    {
      "name": "operator",
      "gid": 37,
      "members": []
    },
    {
      "name": "list",
      "gid": 38,
      "members": []
    },
    {
      "name": "irc",
      "gid": 39,
      "members": []
    },
    {
      "name": "src",
      "gid": 40,
      "members": []
    },
    {
      "name": "shadow",
      "gid": 42,
      "members": []
    },
    {
      "name": "utmp",
      "gid": 43,
      "members": []
    },
    {
      "name": "video",
      "gid": 44,
      "members": []
    },
    {
      "name": "sasl",
      "gid": 45,
      "members": []
    },
    {
      "name": "plugdev",
      "gid": 46,
      "members": []
    },
    {
      "name": "staff",
      "gid": 50,
      "members": []
    },
    {
      "name": "games",
      "gid": 60,
      "members": []
    },
    {
      "name": "users",
      "gid": 100,
      "members": [
        "sandbox"
      ]
    },
    {
      "name": "nogroup",
      "gid": 65534,
      "members": []
    },
    {
      "name": "_ssh",
      "gid": 101,
      "members": []
    },
    {
      "name": "systemd-journal",
      "gid": 999,
      "members": []
    },
    {
      "name": "systemd-network",
      "gid": 998,
      "members": []
    },
    {
      "name": "systemd-timesync",
      "gid": 997,
      "members": []
    },
    {
      "name": "messagebus",
      "gid": 102,
      "members": []
    },
    {
      "name": "polkitd",
      "gid": 996,
      "members": []
    },
    {
      "name": "sandbox",
      "gid": 1000,
      "members": []
    }
  ],
  "cron": {
    "system_crontab": null,
    "cron_d_files": [
      "e2scrub_all"
    ],
    "cron_dirs": {
      "cron.daily": [
        "apt-compat",
        "dpkg"
      ]
    }
  },
  "suid_sgid": [
    {
      "path": "/bin/expiry",
      "mode_octal": "0o2755",
      "suid": false,
      "sgid": true
    },
    {
      "path": "/bin/gpasswd",
      "mode_octal": "0o4755",
      "suid": true,
      "sgid": false
    },
    {
      "path": "/bin/ssh-agent",
      "mode_octal": "0o2755",
      "suid": false,
      "sgid": true
    },
    {
      "path": "/bin/chage",
      "mode_octal": "0o2755",
      "suid": false,
      "sgid": true
    },
    {
      "path": "/bin/passwd",
      "mode_octal": "0o4755",
      "suid": true,
      "sgid": false
    },
    {
      "path": "/bin/newgrp",
      "mode_octal": "0o4755",
      "suid": true,
      "sgid": false
    },
    {
      "path": "/bin/chfn",
      "mode_octal": "0o4755",
      "suid": true,
      "sgid": false
    },
    {
      "path": "/bin/chsh",
      "mode_octal": "0o4755",
      "suid": true,
      "sgid": false
    },
    {
      "path": "/bin/mount",
      "mode_octal": "0o4755",
      "suid": true,
      "sgid": false
    },
    {
      "path": "/bin/su",
      "mode_octal": "0o4755",
      "suid": true,
      "sgid": false
    },
    {
      "path": "/bin/sudo",
      "mode_octal": "0o4755",
      "suid": true,
      "sgid": false
    },
    {
      "path": "/bin/umount",
      "mode_octal": "0o4755",
      "suid": true,
      "sgid": false
    },
    {
      "path": "/sbin/unix_chkpwd",
      "mode_octal": "0o2755",
      "suid": false,
      "sgid": true
    },
    {
      "path": "/usr/bin/expiry",
      "mode_octal": "0o2755",
      "suid": false,
      "sgid": true
    },
    {
      "path": "/usr/bin/gpasswd",
      "mode_octal": "0o4755",
      "suid": true,
      "sgid": false
    },
    {
      "path": "/usr/bin/ssh-agent",
      "mode_octal": "0o2755",
      "suid": false,
      "sgid": true
    },
    {
      "path": "/usr/bin/chage",
      "mode_octal": "0o2755",
      "suid": false,
      "sgid": true
    },
    {
      "path": "/usr/bin/passwd",
      "mode_octal": "0o4755",
      "suid": true,
      "sgid": false
    },
    {
      "path": "/usr/bin/newgrp",
      "mode_octal": "0o4755",
      "suid": true,
      "sgid": false
    },
    {
      "path": "/usr/bin/chfn",
      "mode_octal": "0o4755",
      "suid": true,
      "sgid": false
    },
    {
      "path": "/usr/bin/chsh",
      "mode_octal": "0o4755",
      "suid": true,
      "sgid": false
    },
    {
      "path": "/usr/bin/mount",
      "mode_octal": "0o4755",
      "suid": true,
      "sgid": false
    },
    {
      "path": "/usr/bin/su",
      "mode_octal": "0o4755",
      "suid": true,
      "sgid": false
    },
    {
      "path": "/usr/bin/sudo",
      "mode_octal": "0o4755",
      "suid": true,
      "sgid": false
    },
    {
      "path": "/usr/bin/umount",
      "mode_octal": "0o4755",
      "suid": true,
      "sgid": false
    },
    {
      "path": "/usr/sbin/unix_chkpwd",
      "mode_octal": "0o2755",
      "suid": false,
      "sgid": true
    }
  ],
  "services": [
    "etc/systemd/system/dbus-org.freedesktop.timesync1.service",